<?xml version='1.0' encoding='utf-8'?>
<!DOCTYPE list SYSTEM "talisman_event.dtd">
<list>
	<choice id="1" chance="50">
		<pay>
			<item id="57" count="1000"/>
		</pay>
		<success>
			<item id="57" count="1000"/>
		</success>
		<fail>
			<item id="57" count="1000"/>
		</fail>
	</choice>
</list>